{
  "protocol": "CSNP-RP",
  "version": "1.1.0",
  "observation_id": "hal-extension-0001",
  "observed_at": "2026-08-13T09:00:00Z",
  "previous_receipt_hash": null,
  "metric_profile": {
    "profile_id": "res-rag-hal-reference",
    "profile_version": "1.1.0",
    "state_representation": "example-semantic-encoder-v1",
    "ground_metric": "euclidean",
    "distance_unit": "embedding-distance",
    "time_unit": "second",
    "threshold_policy": "local-calibration-only",
    "temporal_offset_semantics": "signed:RAG-minus-RES",
    "epsilon_min": 0.2,
    "epsilon_max": 0.6,
    "memory_warning": 0.8,
    "organizational_warning": 0.7,
    "anchoring_min": 0.5,
    "irreversibility_horizon": 3,
    "intervention_set": [
      "slowdown",
      "diversify",
      "multitask_brake",
      "retrieve",
      "clarify",
      "human_handoff",
      "stop"
    ],
    "research_claims": [
      {
        "claim_id": "tassan-cecat-0.42",
        "value": 0.42,
        "unit": "dimensionless",
        "status": "reported",
        "source_uri": "https://cv.hal.science/jean-charles-tassan"
      },
      {
        "claim_id": "tassan-goldilocks-upper-0.66",
        "value": 0.66,
        "unit": "dimensionless",
        "status": "reported",
        "source_uri": "https://cv.hal.science/jean-charles-tassan"
      },
      {
        "claim_id": "sterking-tassan-2.14",
        "value": 2.14,
        "unit": "profile-defined",
        "status": "externally_archived",
        "source_uri": "https://doi.org/10.5281/zenodo.18556526"
      }
    ]
  },
  "measurements": {
    "delta_t": 0.18,
    "delta_t_signed": 0.18,
    "dc": 0.42,
    "dr": 0.73,
    "memory_saturation": 0.34,
    "w2_res_rag": 0.4,
    "organizational_incoherence": 0.21,
    "anchoring": 0.9,
    "task_mode": "multi",
    "semantic_cycle_phase": "machine_rag",
    "semantic_cycle_complete": false
  },
  "classification": "governable",
  "intervention": "multitask_brake",
  "evidence": [
    {
      "uri": "https://cv.hal.science/jean-charles-tassan",
      "sha256": "90f564fff9bf2b05db72e97129b83e391f67d1a8209ce94c78c8527d3cdefa95"
    }
  ],
  "state_hash": "5f32142a96fca1459f3b43620fc048f5e5e6da0c7dec4bb36bcea760434d71cb",
  "hash_algorithm": "sha256",
  "canonicalization": "JCS-RFC8785",
  "receipt_hash": "1ad66b674ae166073a4d9caa5e2b6116ecb6d33362ca314271474942573c9231"
}
